{
  "interactionKinds": [
    "baseStacking",
    "phosphateElectrostatic"
  ],
  "receptorResidues": [
    "C:53",
    "U:25",
    "G:26",
    "G:54",
    "G:68",
    "U:7",
    "A:8",
    "A:80"
  ],
  "ligandAtoms": [
    "N1",
    "N2",
    "N3",
    "N5",
    "C4a",
    "C8",
    "C8a",
    "C2",
    "C9",
    "N10",
    "C14"
  ],
  "notes": "Validated against Trausch et al. Structure 2011 (doi:10.1016/j.str.2011.06.007). 3SD3 has U25C mutation in aptamer 1. FFO is folinic acid / (6S)-5-formyl-THF (MW 473). TWO BINDING SITES: Site 3WJ (main): pteridine stacks between G26 and G54; C53 and U25 form H-bonds to pteridine N2/N3 and N1/N8 edges respectively; G68 (bulged) stacks with the aminobenzoate benzene ring. Site PK (secondary): pteridine stacks on A8; U7, U35, U42 H-bond pteridine. Glutamate tail disordered. 2026-06-03: added A:80 as phosphateElectrostatic receptor residue (MacVina detects phosphateElectrostatic A:101:N10/C9 -> A:80:P). Updated ligandAtoms: added C2, C9, N10, C14 (pteridine C2, aminobenzoyl linker, aminobenzoyl tail atoms detected by MacVina). Removed C1b/C2b/C3b/C4b/C5b/C6b (non-existent in PDBQT FFO ligand)."
}
